2025-05-25 07:12:37,316 - function.util_logger2025-05-25-06.52.29 - INFO - Trial 48 finished with value: 0.23568197316390327 and parameters: {'hidden_size_1': 116, 'hidden_size_2': 69, 'activation': 'tanh', 'alpha': 0.0036797192910691555, 'batch_size': 128, 'learning_rate_init': 0.001373824654838324}. Best is trial 32 with value: 0.23245897298572987.
2025-05-25 07:13:28,163 - function.util_logger2025-05-25-06.52.29 - INFO - Trial 49 finished with value: 0.2338133741703862 and parameters: {'hidden_size_1': 112, 'hidden_size_2': 51, 'activation': 'tanh', 'alpha': 0.004028774340304012, 'batch_size': 128, 'learning_rate_init': 0.001247591486954035}. Best is trial 32 with value: 0.23245897298572987.
2025-05-25 07:13:35,032 - function.util_logger2025-05-25-06.52.29 - INFO - Trial 50 finished with value: 0.2364756066529985 and parameters: {'hidden_size_1': 112, 'hidden_size_2': 67, 'activation': 'tanh', 'alpha': 0.0003412193401446801, 'batch_size': 128, 'learning_rate_init': 0.0013744915436965065}. Best is trial 32 with value: 0.23245897298572987.
2025-05-25 07:13:57,289 - function.util_logger2025-05-25-06.52.29 - INFO - Trial 51 finished with value: 0.2352326903183183 and parameters: {'hidden_size_1': 114, 'hidden_size_2': 51, 'activation': 'tanh', 'alpha': 0.00034052083455431435, 'batch_size': 128, 'learning_rate_init': 0.001260767287910535}. Best is trial 32 with value: 0.23245897298572987.
2025-05-25 07:14:38,487 - function.util_logger2025-05-25-06.52.29 - INFO - Trial 53 finished with value: 0.23811792198913068 and parameters: {'hidden_size_1': 114, 'hidden_size_2': 50, 'activation': 'tanh', 'alpha': 0.004159401509963188, 'batch_size': 128, 'learning_rate_init': 0.0010406853822822878}. Best is trial 32 with value: 0.23245897298572987.
2025-05-25 07:14:48,045 - function.util_logger2025-05-25-06.52.29 - INFO - Trial 52 finished with value: 0.23495730422030014 and parameters: {'hidden_size_1': 112, 'hidden_size_2': 52, 'activation': 'tanh', 'alpha': 0.0038432613200785276, 'batch_size': 128, 'learning_rate_init': 0.0010443712576764135}. Best is trial 32 with value: 0.23245897298572987.
2025-05-25 07:14:54,456 - function.util_logger2025-05-25-06.52.29 - INFO - Trial 54 finished with value: 0.2352860801652775 and parameters: {'hidden_size_1': 110, 'hidden_size_2': 50, 'activation': 'tanh', 'alpha': 0.0037485989146552787, 'batch_size': 64, 'learning_rate_init': 0.0010226971075979025}. Best is trial 32 with value: 0.23245897298572987.
2025-05-25 07:15:39,004 - function.util_logger2025-05-25-06.52.29 - INFO - Trial 55 finished with value: 0.25318865750653546 and parameters: {'hidden_size_1': 114, 'hidden_size_2': 50, 'activation': 'relu', 'alpha': 0.00035688928171805876, 'batch_size': 64, 'learning_rate_init': 0.0010281092120131496}. Best is trial 32 with value: 0.23245897298572987.
2025-05-25 07:16:06,171 - function.util_logger2025-05-25-06.52.29 - INFO - Trial 57 finished with value: 0.2539413243486939 and parameters: {'hidden_size_1': 133, 'hidden_size_2': 53, 'activation': 'relu', 'alpha': 0.0004020941754055198, 'batch_size': 64, 'learning_rate_init': 0.0008618916615212082}. Best is trial 32 with value: 0.23245897298572987.
2025-05-25 07:16:37,687 - function.util_logger2025-05-25-06.52.29 - INFO - Trial 56 finished with value: 0.2729059274436849 and parameters: {'hidden_size_1': 134, 'hidden_size_2': 52, 'activation': 'relu', 'alpha': 0.00037046481948237826, 'batch_size': 64, 'learning_rate_init': 0.00024510632840674086}. Best is trial 32 with value: 0.23245897298572987.
2025-05-25 07:16:37,937 - function.util_logger2025-05-25-06.52.29 - INFO - Trial 58 finished with value: 0.2549453748161451 and parameters: {'hidden_size_1': 133, 'hidden_size_2': 52, 'activation': 'relu', 'alpha': 0.0019023942857696475, 'batch_size': 64, 'learning_rate_init': 0.0009053175567112744}. Best is trial 32 with value: 0.23245897298572987.
2025-05-25 07:16:43,854 - function.util_logger2025-05-25-06.52.29 - INFO - Trial 59 finished with value: 0.25345348477548724 and parameters: {'hidden_size_1': 134, 'hidden_size_2': 50, 'activation': 'relu', 'alpha': 0.001860803439549605, 'batch_size': 64, 'learning_rate_init': 0.0009111716256571002}. Best is trial 32 with value: 0.23245897298572987.
2025-05-25 07:16:54,398 - function.util_logger2025-05-25-06.52.29 - INFO - Trial 62 finished with value: 0.2463640572553055 and parameters: {'hidden_size_1': 131, 'hidden_size_2': 54, 'activation': 'relu', 'alpha': 0.006869805873174865, 'batch_size': 64, 'learning_rate_init': 0.002787931634311344}. Best is trial 32 with value: 0.23245897298572987.
2025-05-25 07:16:58,824 - function.util_logger2025-05-25-06.52.29 - INFO - Trial 63 finished with value: 0.2509072707179502 and parameters: {'hidden_size_1': 133, 'hidden_size_2': 60, 'activation': 'relu', 'alpha': 0.0020154287737317784, 'batch_size': 128, 'learning_rate_init': 0.002876431597050834}. Best is trial 32 with value: 0.23245897298572987.
2025-05-25 07:17:04,633 - function.util_logger2025-05-25-06.52.29 - INFO - Trial 61 finished with value: 0.25290015522458387 and parameters: {'hidden_size_1': 133, 'hidden_size_2': 60, 'activation': 'relu', 'alpha': 0.0019484363034771432, 'batch_size': 64, 'learning_rate_init': 0.0008151860212730098}. Best is trial 32 with value: 0.23245897298572987.
2025-05-25 07:17:04,835 - function.util_logger2025-05-25-06.52.29 - INFO - Trial 64 finished with value: 0.2499547542612957 and parameters: {'hidden_size_1': 149, 'hidden_size_2': 66, 'activation': 'tanh', 'alpha': 0.007355705387693835, 'batch_size': 128, 'learning_rate_init': 0.0002804849764595028}. Best is trial 32 with value: 0.23245897298572987.
2025-05-25 07:17:05,548 - function.util_logger2025-05-25-06.52.29 - INFO - Trial 60 finished with value: 0.2521063054766306 and parameters: {'hidden_size_1': 131, 'hidden_size_2': 53, 'activation': 'relu', 'alpha': 0.002088792660174928, 'batch_size': 64, 'learning_rate_init': 0.0008376441231937625}. Best is trial 32 with value: 0.23245897298572987.
2025-05-25 07:17:05,549 - function.util_logger2025-05-25-06.52.29 - INFO - Best params: {'hidden_size_1': 124, 'hidden_size_2': 65, 'activation': 'tanh', 'alpha': 0.0002018754030657419, 'batch_size': 128, 'learning_rate_init': 0.002218399380154698}
2025-05-25 07:17:05,549 - function.util_logger2025-05-25-06.52.29 - INFO - Best MAPE: 0.23245897298572987
2025-05-25 07:17:05,549 - function.util_logger2025-05-25-06.52.29 - INFO - Best trial's average iterations: 21.0
2025-05-25 07:17:05,549 - function.util_logger2025-05-25-06.52.29 - INFO - Best trial's iterations by fold: [13, 31, 20, 18, 23]
2025-05-25 07:17:05,549 - function.util_logger2025-05-25-06.52.29 - INFO - 最佳MLP参数: {'hidden_layer_sizes': (124, 65), 'activation': 'tanh', 'alpha': 0.0002018754030657419, 'batch_size': 128, 'learning_rate_init': 0.002218399380154698, 'max_iter': 21}
